{
  "$schema": "https://json-schema.org/draft/2020-12/schema",
  "type": "object",
  "properties": {
    "version": {
      "const": "ai-infrastructure-ui-contract-v1"
    },
    "productionImplemented": {
      "const": false
    },
    "copyVersion": {
      "const": "ai-infrastructure-public-copy-v1"
    },
    "pagePurpose": {
      "const": "DESCRIPTIVE_PROJECT_EVIDENCE_NOT_FINANCIAL_ASSESSMENT"
    },
    "sectionOrder": {
      "type": "array",
      "items": {
        "type": "string"
      },
      "minItems": 4,
      "maxItems": 4,
      "const": [
        "landscape",
        "financing",
        "power",
        "boundaries"
      ]
    },
    "coreDisclosure": {
      "type": "object",
      "properties": {
        "copyKey": {
          "const": "disclosures.doubleCount"
        },
        "placement": {
          "const": "BEFORE_PROJECT_CARDS_AND_REPEATED_IN_BOUNDARIES"
        },
        "visibility": {
          "const": "ALWAYS_VISIBLE_NOT_COLLAPSED_FOOTNOTE"
        }
      },
      "required": [
        "copyKey",
        "placement",
        "visibility"
      ],
      "additionalProperties": false
    },
    "projectCards": {
      "type": "object",
      "properties": {
        "source": {
          "const": "projects"
        },
        "displayFields": {
          "type": "array",
          "items": {
            "type": "string"
          },
          "minItems": 13,
          "maxItems": 13,
          "const": [
            "companyName",
            "projectName",
            "location",
            "projectStatus",
            "statusEffectiveDate",
            "statusSourceDate",
            "statusAvailableFrom",
            "capacityDisplay",
            "primaryArchetype",
            "powerSummary",
            "publicNotes",
            "publicSourceRefs",
            "lastQualifiedAsOf"
          ]
        },
        "statusDateRequired": {
          "const": true
        },
        "archetypeNotRanking": {
          "const": true
        },
        "missingValueTreatment": {
          "const": "LABELED_NULL_NEVER_ZERO"
        },
        "companyRelationship": {
          "const": "ASSOCIATION_NOT_LEGAL_OWNERSHIP"
        }
      },
      "required": [
        "source",
        "displayFields",
        "statusDateRequired",
        "archetypeNotRanking",
        "missingValueTreatment",
        "companyRelationship"
      ],
      "additionalProperties": false
    },
    "filters": {
      "type": "object",
      "properties": {
        "company": {
          "type": "object",
          "properties": {
            "copyKey": {
              "const": "labels.filterCompany"
            },
            "kind": {
              "const": "CATEGORICAL"
            }
          },
          "required": [
            "copyKey",
            "kind"
          ],
          "additionalProperties": false
        },
        "status": {
          "type": "object",
          "properties": {
            "copyKey": {
              "const": "labels.filterStatus"
            },
            "kind": {
              "const": "DATED_STATUS_CATEGORY"
            }
          },
          "required": [
            "copyKey",
            "kind"
          ],
          "additionalProperties": false
        },
        "archetype": {
          "type": "object",
          "properties": {
            "copyKey": {
              "const": "labels.filterArchetype"
            },
            "kind": {
              "const": "DESCRIPTIVE_CATEGORY"
            },
            "disableWhenAllUnknown": {
              "const": true
            }
          },
          "required": [
            "copyKey",
            "kind",
            "disableWhenAllUnknown"
          ],
          "additionalProperties": false
        }
      },
      "required": [
        "company",
        "status",
        "archetype"
      ],
      "additionalProperties": false
    },
    "table": {
      "type": "object",
      "properties": {
        "semanticElement": {
          "const": "table"
        },
        "captionCopyKey": {
          "const": "labels.table"
        },
        "columnCopyKeys": {
          "type": "array",
          "items": {
            "type": "string"
          },
          "minItems": 9,
          "maxItems": 9,
          "const": [
            "labels.company",
            "labels.project",
            "labels.location",
            "labels.status",
            "labels.capacity",
            "labels.definition",
            "labels.archetype",
            "labels.power",
            "labels.asOf"
          ]
        },
        "headerScope": {
          "const": "col"
        },
        "sourceLinksInCells": {
          "const": true
        },
        "noInvestmentDollarColumn": {
          "const": true
        },
        "mobileAlternative": {
          "const": "ALL_FACTS_IN_STACKED_CARDS"
        }
      },
      "required": [
        "semanticElement",
        "captionCopyKey",
        "columnCopyKeys",
        "headerScope",
        "sourceLinksInCells",
        "noInvestmentDollarColumn",
        "mobileAlternative"
      ],
      "additionalProperties": false
    },
    "map": {
      "type": "object",
      "properties": {
        "optional": {
          "const": true
        },
        "coordinates": {
          "const": "QUALIFIED_ONLY_NONE_IN_THIS_VINTAGE"
        },
        "fields": {
          "type": "array",
          "items": {
            "type": "string"
          },
          "minItems": 6,
          "maxItems": 6,
          "const": [
            "projectId",
            "companyName",
            "projectName",
            "location",
            "projectStatus",
            "primaryArchetype"
          ]
        },
        "navigationFallback": {
          "const": "PROJECT_LIST"
        },
        "noGeocoding": {
          "const": true
        }
      },
      "required": [
        "optional",
        "coordinates",
        "fields",
        "navigationFallback",
        "noGeocoding"
      ],
      "additionalProperties": false
    },
    "financing": {
      "type": "object",
      "properties": {
        "badgeCopyGroup": {
          "const": "financingFeatures"
        },
        "presenceOnly": {
          "const": true
        },
        "emptyMeans": {
          "const": "NOT_QUALIFIED_NOT_ABSENT"
        },
        "currentProjectBadges": {
          "const": false
        },
        "educationSeparateFromProjectFacts": {
          "const": true
        },
        "noAmounts": {
          "const": true
        }
      },
      "required": [
        "badgeCopyGroup",
        "presenceOnly",
        "emptyMeans",
        "currentProjectBadges",
        "educationSeparateFromProjectFacts",
        "noAmounts"
      ],
      "additionalProperties": false
    },
    "power": {
      "type": "object",
      "properties": {
        "source": {
          "const": "projects.powerSummary"
        },
        "utilityInvestmentSeparate": {
          "const": true
        },
        "noCapacityDemandInference": {
          "const": true
        },
        "noInflationConclusion": {
          "const": true
        }
      },
      "required": [
        "source",
        "utilityInvestmentSeparate",
        "noCapacityDemandInference",
        "noInflationConclusion"
      ],
      "additionalProperties": false
    },
    "mobile": {
      "type": "object",
      "properties": {
        "width": {
          "const": 390
        },
        "cards": {
          "const": "SINGLE_COLUMN_STACK"
        },
        "filters": {
          "const": "WRAP_WITH_LABELS"
        },
        "sourceText": {
          "const": "OVERFLOW_WRAP_ANYWHERE"
        },
        "table": {
          "const": "OPTIONAL_CONTAINED_SCROLL_WITH_EQUIVALENT_CARD_CONTENT"
        },
        "pageHorizontalOverflow": {
          "const": "FORBIDDEN"
        }
      },
      "required": [
        "width",
        "cards",
        "filters",
        "sourceText",
        "table",
        "pageHorizontalOverflow"
      ],
      "additionalProperties": false
    },
    "desktop": {
      "type": "object",
      "properties": {
        "width": {
          "const": 1280
        },
        "cards": {
          "const": "LIMITED_TWO_OR_THREE_COLUMN_GRID"
        },
        "sectionOrder": {
          "type": "array",
          "items": {
            "type": "string"
          },
          "minItems": 4,
          "maxItems": 4,
          "const": [
            "landscape",
            "financing",
            "power",
            "boundaries"
          ]
        },
        "map": {
          "const": "OPTIONAL_TEXT_PARITY_REQUIRED"
        }
      },
      "required": [
        "width",
        "cards",
        "sectionOrder",
        "map"
      ],
      "additionalProperties": false
    },
    "accessibility": {
      "type": "object",
      "properties": {
        "keyboard": {
          "const": true
        },
        "nativeLinksButtonsSelects": {
          "const": true
        },
        "focusVisible": {
          "const": true
        },
        "filterLabels": {
          "const": "EN_ZH_COPY_KEYS"
        },
        "semanticTables": {
          "const": true
        },
        "textAlternative": {
          "const": "ALL_MAP_AND_CAPACITY_FACTS_IN_CARDS_AND_TABLE"
        },
        "chartOnlyFacts": {
          "const": false
        },
        "statusNotColorOnly": {
          "const": true
        },
        "newTabAnnouncement": {
          "const": true
        },
        "zeroResultAnnouncement": {
          "const": "labels.noResults"
        },
        "mapRequired": {
          "const": false
        }
      },
      "required": [
        "keyboard",
        "nativeLinksButtonsSelects",
        "focusVisible",
        "filterLabels",
        "semanticTables",
        "textAlternative",
        "chartOnlyFacts",
        "statusNotColorOnly",
        "newTabAnnouncement",
        "zeroResultAnnouncement",
        "mapRequired"
      ],
      "additionalProperties": false
    },
    "forbiddenViews": {
      "type": "array",
      "items": {
        "type": "string"
      },
      "minItems": 5,
      "maxItems": 5,
      "const": [
        "COMPANY_RANKING",
        "CROSS_PROJECT_CAPACITY_BAR_CHART",
        "DOLLAR_TOTAL",
        "RETURN_MODEL",
        "RISK_SCORE"
      ]
    },
    "sources": {
      "type": "object",
      "properties": {
        "officialPublicLinks": {
          "const": true
        },
        "sourcePublicationAndAvailabilitySeparate": {
          "const": true
        },
        "noResearchGraph": {
          "const": true
        }
      },
      "required": [
        "officialPublicLinks",
        "sourcePublicationAndAvailabilitySeparate",
        "noResearchGraph"
      ],
      "additionalProperties": false
    },
    "protection": {
      "type": "object",
      "properties": {
        "noRoute": {
          "const": true
        },
        "noProductionData": {
          "const": true
        },
        "noWorkflow": {
          "const": true
        },
        "noEmail": {
          "const": true
        },
        "noRuntimeAPI": {
          "const": true
        },
        "noSchedule": {
          "const": true
        }
      },
      "required": [
        "noRoute",
        "noProductionData",
        "noWorkflow",
        "noEmail",
        "noRuntimeAPI",
        "noSchedule"
      ],
      "additionalProperties": false
    }
  },
  "required": [
    "version",
    "productionImplemented",
    "copyVersion",
    "pagePurpose",
    "sectionOrder",
    "coreDisclosure",
    "projectCards",
    "filters",
    "table",
    "map",
    "financing",
    "power",
    "mobile",
    "desktop",
    "accessibility",
    "forbiddenViews",
    "sources",
    "protection"
  ],
  "additionalProperties": false
}
